{
  "version": "1.0.0",
  "markets": [
    "jp",
    "us"
  ],
  "sources": [
    {
      "market": "jp",
      "source_family": "jp_statutory_disclosure",
      "source_id": "edinet_api_documents_v2",
      "source_kind": "official_public_api",
      "access_policy_class": "free_public_noauth_review_required",
      "access_patterns": [
        "api_list",
        "api_detail",
        "artifact_download"
      ],
      "issuer_identity_kind": [
        "jp_edinet_code_like"
      ],
      "document_family": [
        "statutory_annual",
        "statutory_quarterly",
        "statutory_current"
      ],
      "artifact_kind": [
        "json",
        "pdf",
        "xbrl",
        "zip"
      ],
      "current_repo_status": "implemented",
      "evidence_files": [
        "ucel/crates/ucel-ir/src/providers/edinet/mod.rs",
        "ucel/crates/ucel-ir/README.md",
        "docs/specs/ucel/ir_connector_spec.md"
      ],
      "evidence_kinds": [
        "provider_impl",
        "readme",
        "spec"
      ],
      "notes": "API key is optional in repo implementation; no-auth path exists but may be degraded."
    },
    {
      "market": "jp",
      "source_family": "jp_timely_disclosure",
      "source_id": "jp_tdnet_timely_html",
      "source_kind": "official_public_html",
      "access_policy_class": "free_public_noauth_review_required",
      "access_patterns": [
        "html_index",
        "html_detail",
        "artifact_download"
      ],
      "issuer_identity_kind": [
        "jp_exchange_code_like"
      ],
      "document_family": [
        "timely_disclosure"
      ],
      "artifact_kind": [
        "html",
        "pdf"
      ],
      "current_repo_status": "not_implemented",
      "evidence_files": [
        "docs/specs/ucel/ir_connector_spec.md"
      ],
      "evidence_kinds": [
        "spec"
      ],
      "notes": "TDNET appears in connector spec source_type examples; implementation to follow in later tasks."
    },
    {
      "market": "jp",
      "source_family": "jp_issuer_ir_site",
      "source_id": "jp_issuer_ir_html_public",
      "source_kind": "issuer_ir_html",
      "access_policy_class": "free_public_noauth_review_required",
      "access_patterns": [
        "issuer_lookup",
        "html_index",
        "html_detail",
        "attachment_discover",
        "artifact_download"
      ],
      "issuer_identity_kind": [
        "issuer_site_slug_like",
        "url_like",
        "jp_local_code_like"
      ],
      "document_family": [
        "earnings_release",
        "earnings_presentation",
        "integrated_report",
        "sustainability_report",
        "governance_report",
        "misc_ir_document"
      ],
      "artifact_kind": [
        "html",
        "pdf"
      ],
      "current_repo_status": "implemented",
      "evidence_files": [
        "docs/specs/ucel/ir_connector_spec.md"
      ],
      "evidence_kinds": [
        "spec"
      ],
      "notes": "Connector spec states web/html/pdf source_type handling under IR connector scope."
    },
    {
      "market": "jp",
      "source_family": "jp_issuer_ir_site",
      "source_id": "jp_issuer_ir_feed_public",
      "source_kind": "issuer_ir_feed",
      "access_policy_class": "free_public_noauth_review_required",
      "access_patterns": [
        "rss_poll",
        "feed_poll",
        "artifact_download"
      ],
      "issuer_identity_kind": [
        "url_like"
      ],
      "document_family": [
        "press_release",
        "earnings_release"
      ],
      "artifact_kind": [
        "rss",
        "pdf",
        "html"
      ],
      "current_repo_status": "implemented",
      "evidence_files": [
        "docs/specs/ucel/ir_connector_spec.md"
      ],
      "evidence_kinds": [
        "spec"
      ],
      "notes": "Feed ingestion is part of IR connector source abstraction; concrete adapter pending."
    },
    {
      "market": "us",
      "source_family": "us_sec_disclosure",
      "source_id": "sec_edgar_submissions_api",
      "source_kind": "official_public_api",
      "access_policy_class": "free_public_noauth_allowed",
      "access_patterns": [
        "api_list",
        "api_detail",
        "artifact_download",
        "issuer_lookup"
      ],
      "issuer_identity_kind": [
        "us_cik_like",
        "ticker_like"
      ],
      "document_family": [
        "statutory_annual",
        "statutory_quarterly",
        "statutory_current",
        "proxy"
      ],
      "artifact_kind": [
        "json",
        "html",
        "ixbrl",
        "txt"
      ],
      "current_repo_status": "implemented",
      "evidence_files": [
        "ucel/crates/ucel-ir/src/providers/sec_edgar/mod.rs",
        "ucel/crates/ucel-ir/src/providers/sec_edgar/ticker_cik.rs",
        "ucel/crates/ucel-ir/README.md"
      ],
      "evidence_kinds": [
        "provider_impl",
        "identity_map",
        "readme"
      ],
      "notes": "SEC provider requires user-agent but no login/auth contract in repo."
    },
    {
      "market": "us",
      "source_family": "us_issuer_ir_site",
      "source_id": "us_issuer_ir_html_public",
      "source_kind": "issuer_ir_html",
      "access_policy_class": "free_public_noauth_review_required",
      "access_patterns": [
        "issuer_lookup",
        "html_index",
        "html_detail",
        "attachment_discover",
        "artifact_download"
      ],
      "issuer_identity_kind": [
        "exchange_ticker_like",
        "issuer_site_slug_like",
        "url_like"
      ],
      "document_family": [
        "earnings_presentation",
        "transcript",
        "fact_sheet",
        "press_release",
        "misc_ir_document"
      ],
      "artifact_kind": [
        "html",
        "pdf"
      ],
      "current_repo_status": "implemented",
      "evidence_files": [
        "docs/specs/ucel/ir_connector_spec.md"
      ],
      "evidence_kinds": [
        "spec"
      ],
      "notes": "US issuer-site class is in connector non-regulatory source abstraction."
    },
    {
      "market": "us",
      "source_family": "us_issuer_ir_site",
      "source_id": "us_issuer_ir_feed_public",
      "source_kind": "issuer_ir_feed",
      "access_policy_class": "free_public_noauth_review_required",
      "access_patterns": [
        "rss_poll",
        "feed_poll",
        "artifact_download"
      ],
      "issuer_identity_kind": [
        "url_like"
      ],
      "document_family": [
        "press_release",
        "fact_sheet"
      ],
      "artifact_kind": [
        "rss",
        "pdf",
        "html"
      ],
      "current_repo_status": "implemented",
      "evidence_files": [
        "docs/specs/ucel/ir_connector_spec.md"
      ],
      "evidence_kinds": [
        "spec"
      ],
      "notes": "Feed shape specified in connector model; concrete source adapters pending."
    }
  ],
  "identities": [
    {
      "market": "jp",
      "identity_kind": "jp_edinet_code_like",
      "source_id": "edinet_api_documents_v2",
      "canonical_role": "primary_regulatory_id",
      "evidence_files": [
        "ucel/crates/ucel-ir/src/domain/ids.rs"
      ],
      "notes": "CanonicalEntityId::EdinetCode"
    },
    {
      "market": "jp",
      "identity_kind": "jp_exchange_code_like",
      "source_id": "jp_tdnet_timely_html",
      "canonical_role": "secondary_market_id",
      "evidence_files": [
        "docs/specs/ucel/ir_connector_spec.md"
      ],
      "notes": "issuer_id normalization requirement"
    },
    {
      "market": "jp",
      "identity_kind": "issuer_site_slug_like",
      "source_id": "jp_issuer_ir_html_public",
      "canonical_role": "issuer_site_locator",
      "evidence_files": [
        "docs/specs/ucel/ir_connector_spec.md"
      ],
      "notes": "issuer-site locator taxonomy"
    },
    {
      "market": "jp",
      "identity_kind": "url_like",
      "source_id": "jp_issuer_ir_feed_public",
      "canonical_role": "issuer_site_locator",
      "evidence_files": [
        "docs/specs/ucel/ir_connector_spec.md"
      ],
      "notes": "feed endpoint URI identity"
    },
    {
      "market": "us",
      "identity_kind": "us_cik_like",
      "source_id": "sec_edgar_submissions_api",
      "canonical_role": "primary_regulatory_id",
      "evidence_files": [
        "ucel/crates/ucel-ir/src/domain/ids.rs",
        "ucel/crates/ucel-ir/src/providers/sec_edgar/ticker_cik.rs"
      ],
      "notes": "CIK canonical id"
    },
    {
      "market": "us",
      "identity_kind": "ticker_like",
      "source_id": "sec_edgar_submissions_api",
      "canonical_role": "lookup_alias",
      "evidence_files": [
        "ucel/crates/ucel-ir/src/providers/sec_edgar/ticker_cik.rs"
      ],
      "notes": "ticker->CIK mapping"
    },
    {
      "market": "us",
      "identity_kind": "exchange_ticker_like",
      "source_id": "us_issuer_ir_html_public",
      "canonical_role": "secondary_market_id",
      "evidence_files": [
        "docs/specs/ucel/ir_connector_spec.md"
      ],
      "notes": "issuer-side listing identity"
    },
    {
      "market": "us",
      "identity_kind": "url_like",
      "source_id": "us_issuer_ir_feed_public",
      "canonical_role": "issuer_site_locator",
      "evidence_files": [
        "docs/specs/ucel/ir_connector_spec.md"
      ],
      "notes": "feed endpoint URI identity"
    }
  ],
  "documents": [
    {
      "market": "jp",
      "source_id": "edinet_api_documents_v2",
      "document_family": "statutory_annual",
      "artifact_kind": "json",
      "issuer_identity_kind": "jp_edinet_code_like",
      "access_pattern": "api_list",
      "access_policy_class": "free_public_noauth_review_required",
      "current_repo_status": "implemented",
      "evidence_files": [
        "ucel/crates/ucel-ir/src/providers/edinet/mod.rs"
      ],
      "notes": "daily list API"
    },
    {
      "market": "jp",
      "source_id": "edinet_api_documents_v2",
      "document_family": "statutory_quarterly",
      "artifact_kind": "xbrl",